{
  "name": "new_default_3d",
   "description": "Improved 3D nuclear instance segmentation using watershed, high-mask fraction filtering, flow divergence, and shell merging.",
  "version": "42.5.0",
  "order": 10,
  "tasks": {
    "nuclear": { "supported": true },
    "cytoplasmic": { "supported": false }
  },
  "settings": [
    {
      "key": "cell_diameter_px",
      "label": "Cell diameter (px)",
      "tooltip": "Average cell diameter in pixels. Typical: small=60, medium=80-100, large=120.",
      "type": "float",
      "decimals": 0,
      "min": 0.0,
      "max": 300.0,
      "default": 100.0
    },
    {
      "key": "mask_threshold",
      "label": "Mask threshold",
      "tooltip": "Base probability threshold for binary foreground mask. Lower = more sensitive (more cells, more false positives). Higher = stricter (fewer cells, fewer false positives).",
      "type": "float",
      "decimals": 2,
      "min": 0.0,
      "max": 1.0,
      "default": 0.55
    },
    {
      "key": "high_mask_threshold",
      "label": "High mask threshold",
      "tooltip": "Voxel-level mask probability threshold for 'definitely cell' classification. The high-mask fraction filter counts what fraction of each instance's voxels exceed this. Real cells have many voxels above 0.96; background has few.",
      "type": "float",
      "decimals": 2,
      "min": 0.5,
      "max": 1.0,
      "default": 0.92
    },
    {
      "key": "min_high_mask_fraction",
      "label": "Min high-mask fraction",
      "tooltip": "Minimum fraction of instance voxels that must exceed the high mask threshold to be kept. Real cells: 30-80%. Background leakage: 0-5%. Raise (0.10-0.15) to remove more false positives. Lower (0.02-0.03) to keep more small cells.",
      "type": "float",
      "decimals": 3,
      "min": 0.0,
      "max": 1.0,
      "default": 0.08
    }
  ]
}
