{
  "name": "default_2d",
  "description": "Fine-tuned StarDist 2D model for nuclear segmentation.",
  "version": "0.1.0",
  "order": 1,
  "tasks": {
    "nuclear": {
      "supported": true
    },
    "cytoplasmic": {
      "supported": false
    }
  },
  "settings": [
    {
      "key": "object_diameter_px",
      "label": "Object diameter (px)",
      "tooltip": "Estimated average nucleus diameter in pixels used for object-size scaling.",
      "type": "float",
      "decimals": 1,
      "min": 1.0,
      "max": 500.0,
      "default": 30.0
    },
    {
      "key": "prob_thresh",
      "label": "Prob threshold",
      "tooltip": "Minimum object probability required to keep a predicted nucleus candidate.",
      "type": "float",
      "decimals": 3,
      "min": 0.0,
      "max": 1.0,
      "default": 0.496187
    },
    {
      "key": "nms_thresh",
      "label": "NMS threshold",
      "tooltip": "Overlap threshold for non-maximum suppression when removing duplicate detections.",
      "type": "float",
      "decimals": 3,
      "min": 0.0,
      "max": 1.0,
      "default": 0.3
    }
  ]
}
