{
  "name": "stardist_onnx_2d",
  "description": "StarDist 2D nuclear segmentation using ONNX runtime",
  "version": "0.1.0",
  "tasks": {
    "nuclear": {
      "supported": true
    },
    "cytoplasmic": {
      "supported": false
    }
  },
  "settings": [
    {
      "key": "normalize",
      "label": "Normalize",
      "type": "bool",
      "default": true
    },
    {
      "key": "pmin",
      "label": "Percentile min",
      "type": "float",
      "decimals": 1,
      "min": 0.0,
      "max": 100.0,
      "default": 1.0,
      "enabled_by": "normalize"
    },
    {
      "key": "pmax",
      "label": "Percentile max",
      "type": "float",
      "decimals": 1,
      "min": 0.0,
      "max": 100.0,
      "default": 99.8,
      "enabled_by": "normalize"
    },
    {
      "key": "prob_thresh",
      "label": "Prob threshold",
      "type": "float",
      "decimals": 3,
      "min": 0.0,
      "max": 1.0,
      "default": 0.479071
    },
    {
      "key": "nms_thresh",
      "label": "NMS threshold",
      "type": "float",
      "decimals": 3,
      "min": 0.0,
      "max": 1.0,
      "default": 0.3
    }
  ]
}
