{
  "name": "rmp",
  "description": "RMP spot detector implementation",
  "version": "0.1.0",
  "order": 0,
  "settings": [
    {
      "key": "extraction_kernel_length",
      "label": "Spot diameter (px)",
      "tooltip": "Estimated spot diameter in pixels used to build the RMP structuring element.",
      "type": "int",
      "min": 3,
      "max": 9999,
      "default": 10
    },
    {
      "key": "manual_threshold",
      "label": "Manual threshold",
      "tooltip": "Fixed normalized threshold used when Auto threshold is disabled.",
      "type": "float",
      "decimals": 2,
      "min": 0.0,
      "max": 1.0,
      "default": 0.50,
      "disabled_by": "auto_threshold"
    },
    {
      "key": "auto_threshold",
      "label": "Auto threshold",
      "tooltip": "Automatically estimate threshold from the processed image using Otsu.",
      "type": "bool",
      "default": true
    }
  ]
}
