{
  "name": "stardist_onnx",
  "description": "StarDist ONNX nuclear model skeleton",
  "version": "0.1.0",
  "tasks": {
    "nuclear": {
      "supported": true
    },
    "cytoplasmic": {
      "supported": false
    }
  },
  "settings": [
    {
      "key": "prob_thresh",
      "label": "Probability threshold",
      "type": "float",
      "decimals": 2,
      "min": 0.0,
      "max": 1.0,
      "default": 0.5
    },
    {
      "key": "nms_thresh",
      "label": "NMS threshold",
      "type": "float",
      "decimals": 2,
      "min": 0.0,
      "max": 1.0,
      "default": 0.4
    },
    {
      "key": "normalize",
      "label": "Normalize",
      "type": "bool",
      "default": true
    },
    {
      "key": "pmin",
      "label": "Normalize p-min",
      "type": "float",
      "decimals": 1,
      "min": 0.0,
      "max": 20.0,
      "default": 1.0
    },
    {
      "key": "pmax",
      "label": "Normalize p-max",
      "type": "float",
      "decimals": 1,
      "min": 80.0,
      "max": 100.0,
      "default": 99.8
    }
  ]
}
