{
  "name": "cyto_only",
  "description": "Placeholder details for a cytoplasmic-only model",
  "version": "0.1.0",
  "tasks": {
    "nuclear": {
      "supported": false
    },
    "cytoplasmic": {
      "supported": true,
      "input_modes": ["cytoplasmic"],
      "nuclear_channel_optional": true
    }
  },
  "settings": [
    {
      "key": "min_size",
      "label": "Min size",
      "type": "float",
      "decimals": 1,
      "min": 0.0,
      "max": 500.0,
      "default": 50.0
    }
  ]
}
