{
  "name": "nuclear_dilation",
  "description": "Dilates nuclear masks to approximate cytoplasm",
  "version": "0.1.0",
  "order": 4,
  "tasks": {
    "nuclear": {
      "supported": false
    },
    "cytoplasmic": {
      "supported": true,
      "input_modes": ["nuclear"],
      "nuclear_channel_optional": false
    }
  },
  "settings": [
    {
      "key": "dilation_px",
      "label": "Dilation (px)",
      "tooltip": "Pixels to dilate outward from each nuclear mask to approximate cytoplasm.",
      "type": "int",
      "min": 1,
      "max": 100,
      "default": 5
    }
  ]
}
