{
  "name": "perinuclear_rings",
  "description": "Creates perinuclear rings from nuclear masks",
  "version": "0.1.0",
  "order": 5,
  "tasks": {
    "nuclear": {
      "supported": false
    },
    "cytoplasmic": {
      "supported": true,
      "input_modes": ["nuclear"],
      "nuclear_channel_optional": false
    }
  },
  "settings": [
    {
      "key": "erosion_px",
      "label": "Inner erosion (px)",
      "tooltip": "Pixels to erode inward from the nuclear boundary before building the ring.",
      "type": "int",
      "min": 1,
      "max": 50,
      "default": 2
    },
    {
      "key": "dilation_px",
      "label": "Outer dilation (px)",
      "tooltip": "Pixels to dilate outward from the nuclear boundary to set ring thickness (0 means no outward dilation).",
      "type": "int",
      "min": 0,
      "max": 50,
      "default": 5
    }
  ]
}
