{
  "name": "default_3d_stardist",
  "description": "Restored fine-tuned StarDist 3D model with voxel-spacing correction.",
  "version": "0.2.0",
  "order": 2,
  "tasks": {
    "nuclear": {
      "supported": true
    },
    "cytoplasmic": {
      "supported": false
    }
  },
  "settings": [
    {
      "key": "object_diameter_px",
      "label": "Object diameter (px)",
      "tooltip": "Estimated average nucleus diameter in pixels. This controls overall object-size scaling; image metadata automatically corrects relative Z, Y, and X voxel geometry when available.",
      "type": "float",
      "decimals": 1,
      "min": 1.0,
      "max": 500.0,
      "default": 30.0
    },
    {
      "key": "prob_thresh",
      "label": "Prob threshold",
      "tooltip": "Minimum object probability required to keep a predicted nucleus candidate.",
      "type": "float",
      "decimals": 3,
      "min": 0.0,
      "max": 1.0,
      "default": 0.4451190689256302
    },
    {
      "key": "nms_thresh",
      "label": "NMS threshold",
      "tooltip": "Overlap threshold for non-maximum suppression when removing duplicate detections.",
      "type": "float",
      "decimals": 3,
      "min": 0.0,
      "max": 1.0,
      "default": 0.3
    }
  ]
}
